{
  "schemaVersion": "1.0.0",
  "generatedAt": "2026-06-20T22:53:14.9293932Z",
  "source": "services/executive-cockpit/generate-executive-cockpit.ps1",
  "status": "ok",
  "sectionId": "executive-command",
  "cards": [
    {
      "id": "executive.task.numberninjadesigns-001",
      "title": "Build Etsy listing workflow foundation",
      "status": "ok",
      "description": "Blocks 1 task",
      "facts": [
        {
          "label": "Project",
          "value": "numberninjadesigns"
        },
        {
          "label": "Priority",
          "value": 91
        },
        {
          "label": "ROI",
          "value": 92
        },
        {
          "label": "Task",
          "value": "numberninjadesigns-001"
        }
      ],
      "actionHint": "Open the highest-priority task Codex prompt and use it as the next practical delivery input.",
      "lineage": {
        "sourceReport": "runtime/dashboard/project-delivery.view.json",
        "sourceContract": "config/delivery.tasks.json + config/delivery.scoring.json",
        "sourceService": "services/project-delivery/generate-project-delivery.ps1"
      }
    },
    {
      "id": "executive.opportunity.opp.pivot-table-operator",
      "title": "Pivot Table Operator",
      "status": "ok",
      "description": "Excel Users, Data Analysts, Spreadsheet Nerds",
      "facts": [
        {
          "label": "Classification",
          "value": "A"
        },
        {
          "label": "Confidence",
          "value": 92.0
        },
        {
          "label": "Kind",
          "value": "product"
        },
        {
          "label": "Evidence",
          "value": 3
        }
      ],
      "actionHint": "Review evidence and decide APPROVED or REJECTED in a future human-controlled approval pass.",
      "lineage": {
        "sourceReport": "runtime/market-intelligence/opportunities.report.json",
        "sourceContract": "shared/contracts/market-intelligence/opportunities.contract.json",
        "sourceService": "services/market-intelligence/generate-market-intelligence.ps1"
      }
    },
    {
      "id": "executive.opportunity.opp.query-before-coffee",
      "title": "Query Before Coffee",
      "status": "ok",
      "description": "SQL Developers, Programmers, Software Engineers",
      "facts": [
        {
          "label": "Classification",
          "value": "B"
        },
        {
          "label": "Confidence",
          "value": 86.0
        },
        {
          "label": "Kind",
          "value": "product"
        },
        {
          "label": "Evidence",
          "value": 1
        }
      ],
      "actionHint": "Review evidence and decide APPROVED or REJECTED in a future human-controlled approval pass.",
      "lineage": {
        "sourceReport": "runtime/market-intelligence/opportunities.report.json",
        "sourceContract": "shared/contracts/market-intelligence/opportunities.contract.json",
        "sourceService": "services/market-intelligence/generate-market-intelligence.ps1"
      }
    },
    {
      "id": "executive.opportunity.opp.model-is-overfitting",
      "title": "Model Is Overfitting",
      "status": "ok",
      "description": "Machine Learning Engineers, AI Engineers, Data Scientists",
      "facts": [
        {
          "label": "Classification",
          "value": "B"
        },
        {
          "label": "Confidence",
          "value": 85.0
        },
        {
          "label": "Kind",
          "value": "product"
        },
        {
          "label": "Evidence",
          "value": 1
        }
      ],
      "actionHint": "Review evidence and decide APPROVED or REJECTED in a future human-controlled approval pass.",
      "lineage": {
        "sourceReport": "runtime/market-intelligence/opportunities.report.json",
        "sourceContract": "shared/contracts/market-intelligence/opportunities.contract.json",
        "sourceService": "services/market-intelligence/generate-market-intelligence.ps1"
      }
    },
    {
      "id": "executive.opportunity.opp.pivot-table-content-system",
      "title": "Pivot Table Operator content angles",
      "status": "ok",
      "description": "Excel Users, Data Analysts, Business Analysts",
      "facts": [
        {
          "label": "Classification",
          "value": "B"
        },
        {
          "label": "Confidence",
          "value": 79.0
        },
        {
          "label": "Kind",
          "value": "content"
        },
        {
          "label": "Evidence",
          "value": 2
        }
      ],
      "actionHint": "Review evidence and decide APPROVED or REJECTED in a future human-controlled approval pass.",
      "lineage": {
        "sourceReport": "runtime/market-intelligence/opportunities.report.json",
        "sourceContract": "shared/contracts/market-intelligence/opportunities.contract.json",
        "sourceService": "services/market-intelligence/generate-market-intelligence.ps1"
      }
    }
  ],
  "lineage": {
    "sourceReports": [
      "runtime/dashboard/project-delivery.view.json",
      "runtime/market-intelligence/opportunities.report.json"
    ],
    "sourceContracts": [
      "config/delivery.tasks.json",
      "shared/contracts/market-intelligence/opportunities.contract.json"
    ],
    "sourceServices": [
      "services/market-intelligence/generate-market-intelligence.ps1",
      "services/project-delivery/generate-project-delivery.ps1"
    ]
  },
  "boundaries": {
    "readOnly": true,
    "executionEngine": false,
    "providerExecution": false,
    "publishingExecution": false,
    "schedulerExecution": false,
    "oauthCapability": false,
    "credentialAccess": false,
    "secretAccess": false,
    "agentExecution": false,
    "automaticDecisionMaking": false
  }
}
